TopicID,Keywords,Weights
0,"southwestair, airlin, plane, flight, pilot, vaccin, southwest, passeng, http, hour","0.04, 0.025, 0.021, 0.019, 0.015, 0.01, 0.01, 0.008, 0.008, 0.007"
1,"airlin, southwestair, southwest, flight, http, delai, worst, time, plane, custom","0.065, 0.039, 0.033, 0.03, 0.014, 0.013, 0.009, 0.009, 0.007, 0.007"
2,"airlin, southwest, flight, southwestair, pilot, http, ground, issu, la, technic","0.05, 0.037, 0.026, 0.016, 0.014, 0.01, 0.008, 0.007, 0.007, 0.007"
3,"flight, airlin, southwestair, southwest, http, plane, delai, cancel, custom, travel","0.042, 0.037, 0.034, 0.015, 0.01, 0.01, 0.009, 0.007, 0.006, 0.005"
4,"southwestair, flight, plane, airlin, fly, passeng, chang, americanair, issu, let","0.024, 0.02, 0.017, 0.015, 0.007, 0.007, 0.006, 0.006, 0.006, 0.006"
